{
  "filename": "CV.pdf",
  "name": "Eman Ijaz",
  "email": "ijaze155@gmail.com",
  "phone": "923344001396",
  "linkedin": "https://www.linkedin.com/in/eman-ijaz-7013ab256/",
  "github": "",
  "certificates": [],
  "skills": [
    "Communication",
    "Critical Thinking",
    "Problem-Solving",
    "Time Management",
    "Adaptability"
  ],
  "tools": [
    "Cadence Virtuoso",
    "Cadence Genus",
    "Cadence Innovus",
    "OpenLane",
    "Xilinx Vivado",
    "MentorGraphics QuestaSim",
    "Keil uVision",
    "AutoCAD",
    "Altium Designer",
    "MATLAB",
    "Simulink"
  ],
  "technologies": [
    "MATLAB",
    "C",
    "SystemVerilog",
    "Python",
    "Shell scripting"
  ],
  "certifications": [],
  "projects": [
    {
      "title": "UETRV-PCore Hardware Implementation",
      "description": "Analyzed RTL design and performed Genus synthesis of UETRV-PCore for optimized hardware implementation."
    },
    {
      "title": "Gesture-Controlled Car",
      "description": "Designed and implemented a gesture-controlled car utilizing Tiva, MPU, ESP32, and ESP01, demonstrating expertise in microcontroller programming, sensor integration, and wireless communication."
    },
    {
      "title": "UART Transmitter",
      "description": "Developed a UART transmitter for serial communication, highlighting proficiency in embedded systems and communication protocols."
    },
    {
      "title": "PCB Designs",
      "description": "Developed multiple PCB designs using Altium Designer, exhibiting proficiency in PCB layout and design software."
    },
    {
      "title": "Hangman Game",
      "description": "Developed a Hangman game in Python."
    },
    {
      "title": "Radome Design",
      "description": "Radome Design of automobile radar systems."
    },
    {
      "title": "Line Following Robot",
      "description": "Developed a Line Following Robot."
    }
  ],
  "education": [
    {
      "degree": "BSc",
      "field": "Electrical Engineering",
      "institute": "University of Engineering and Technology",
      "years": "2021 - 2025"
    },
    {
      "degree": "FSc",
      "field": "Pre Engineering",
      "institute": "Queen Mary College",
      "years": "2019 - 2021"
    }
  ],
  "experience": [
    {
      "company": "MEDS Lab UET LHR",
      "role": "Research Assistant",
      "years": "June 2023 - Sep 2023",
      "description": "Completed 2-month training in computer architecture and executed notable technical projects successfully."
    },
    {
      "company": "Karachi Automation",
      "role": "Intern",
      "years": "Oct 2023 - Nov 2023",
      "description": "Basic PLC, HMI and Industrial Automation."
    }
  ],
  "raw_text": "eman ijaz lahore, pakistan +923344001396 | ijaze155@gmail.com | https://www.linkedin.com/in/eman-ijaz-7013ab256/ objective passionate electrical engineer with expertise in circuit design, digital designing, and project management. seeking to innovate and excel in a dynamic role, contributing technical excellence and sustainable solutions to advance technology and drive organizational growth. education university of engineering and technology bsc electrical engineering (cgpa : 2.94) queen mary college fsc pre engineering (marks : 1009/1100) experience meds lab uet lhr research assistant • completed 2-month training in computer architecture • executed notable technical projects successfully karachi automation intern • basic plc, hmi and industrial automation projects lahore, pakistan 2021 - 2025 lahore, pakistan 2019 - 2021 june 2023 - sep 2023 lahore, pakistan oct 2023 - nov 2023 lahore, pakistan • analyzed rtl design and performed genus synthesis of uetrv-pcore for optimized hardware implementation. • designed and implemented a gesture-controlled car utilizing tiva, mpu, esp32, and esp01, demonstrating expertise in microcontroller programming, sensor integration, and wireless communication. • developed a uart transmitter for serial communication, highlighting proficiency in embedded systems and communication protocols. • developed multiple pcb designs using altium designer, exhibiting proficiency in pcb layout and design software. • developed a hangman game in python, radome design of automobile radar systems and lfr (line following robot). extracurricular and volunteer experience iet on campus uet lhr vice president sep 2024 - present lahore, pakistan • led and coordinated technical events, workshops, and initiatives to enhance student engagement and professional development. gdsc uet lhr executive head sep 2023 - sep 2024 lahore, pakistan • served as executive head of the design team at gdsc uet lahore, creating posters for events and social media posts, gaining extensive experience in graphic design and visual communication. skills • design and simulation tools: cadence (virtuoso, genus, innovus), openlane, xilinx vivado, mentorgraphics questasim, keil u vision, autocad, altium designer, matlab and simulink • programming and scripting: matlab, c, systemverilog, python, shell scripting • soft skills: communication, critical thinking, problem-solving, time management and adaptability"
}